
/dev/sg2:

ATA device, with non-removable media
	Model Number:       ST2000NM0011                            
	Serial Number:      Z1P4HP54
	Firmware Revision:  PA03
	Transport:          Serial, SATA Rev 3.0
Standards:
	Used: unknown (minor revision code 0x0029) 
	Supported: 8 7 6 5 
	Likely used: 8
Configuration:
	Logical		max	current
	cylinders	16383	16383
	heads		16	16
	sectors/track	63	63
	--
	CHS current addressable sectors:    16514064
	LBA    user addressable sectors:   268435455
	LBA48  user addressable sectors:  3907029168
	Logical  Sector size:                   512 bytes
	Physical Sector size:                   512 bytes
	device size with M = 1024*1024:     1907729 MBytes
	device size with M = 1000*1000:     2000398 MBytes (2000 GB)
	cache/buffer size  = unknown
	Form Factor: 3.5 inch
	Nominal Media Rotation Rate: 7202
Capabilities:
	LBA, IORDY(can be disabled)
	Queue depth: 32
	Standby timer values: spec'd by Standard, no device specific minimum
	R/W multiple sector transfer: Max = 16	Current = ?
	Recommended acoustic management value: 254, current value: 0
	DMA: mdma0 mdma1 mdma2 udma0 udma1 udma2 udma3 udma4 udma5 *udma6 
	     Cycle time: min=120ns recommended=120ns
	PIO: pio0 pio1 pio2 pio3 pio4 
	     Cycle time: no flow control=120ns  IORDY flow control=120ns
Commands/features:
	Enabled	Supported:
	   *	SMART feature set
	    	Security Mode feature set
	   *	Power Management feature set
	    	Write cache
	   *	Look-ahead
	   *	Host Protected Area feature set
	   *	WRITE_BUFFER command
	   *	READ_BUFFER command
	   *	DOWNLOAD_MICROCODE
	    	SET_MAX security extension
	   *	48-bit Address feature set
	   *	Device Configuration Overlay feature set
	   *	Mandatory FLUSH_CACHE
	   *	FLUSH_CACHE_EXT
	   *	SMART error logging
	   *	SMART self-test
	   *	General Purpose Logging feature set
	   *	WRITE_{DMA|MULTIPLE}_FUA_EXT
	   *	64-bit World wide name
	    	Write-Read-Verify feature set
	   *	WRITE_UNCORRECTABLE_EXT command
	   *	{READ,WRITE}_DMA_EXT_GPL commands
	   *	Segmented DOWNLOAD_MICROCODE
	   *	Gen1 signaling speed (1.5Gb/s)
	   *	Gen2 signaling speed (3.0Gb/s)
	   *	Native Command Queueing (NCQ)
	   *	Phy event counters
	   *	READ_LOG_DMA_EXT equivalent to READ_LOG_EXT
	    	Device-initiated interface power management
	   *	Software settings preservation
	   *	SMART Command Transport (SCT) feature set
	   *	SCT Write Same (AC2)
	   *	SCT Error Recovery Control (AC3)
	   *	SCT Features Control (AC4)
	   *	SCT Data Tables (AC5)
	    	unknown 206[7]
	    	unknown 206[12] (vendor specific)
Security: 
	Master password revision code = 65534
		supported
	not	enabled
	not	locked
	not	frozen
	not	expired: security count
		supported: enhanced erase
	288min for SECURITY ERASE UNIT. 288min for ENHANCED SECURITY ERASE UNIT.
Logical Unit WWN Device Identifier: 5000c5004f3ed021
	NAA		: 5
	IEEE OUI	: 000c50
	Unique ID	: 04f3ed021
Checksum: correct
